{
  "schema_version": "0.1.0",
  "provenance_id": "AION_CHANGE_LEVEL_PROVENANCE_V0.1.0",
  "scope": "CURRENT_CONVERGENCE_FINAL_REVIEW_FIXES_ONLY",
  "branch": "engineering/aion-research-consolidation-literature-grounding-readiness-20260814",
  "base_head": "88b9a5ab347d475612809fdcd9215116d9862b87",
  "canonical_effect": "NONE",
  "deployment": false,
  "roles": {
    "human_owner_proposal_and_authority": {
      "actor": "HUMAN_OWNER",
      "role": "PROPOSAL_AND_AUTHORITY_BOUNDARY",
      "status": "OWNER_APPROVAL_PENDING",
      "authority_effect": "NONE",
      "description": "Requested final-review corrections and retains authority to approve any future setting, canonical or promotion action."
    },
    "chatgpt_architecture_and_review": {
      "actor": "CHATGPT",
      "role": "ARCHITECTURE_REVIEW_AND_TASK_REFINEMENT",
      "status": "REVIEW_INPUT",
      "authority_effect": "NONE",
      "description": "Provided architecture/review framing and review constraints; did not grant authority or canonical status."
    },
    "manus_implementation": {
      "actor": "MANUS",
      "role": "CONVERGENCE_IMPLEMENTATION_AND_VALIDATION",
      "status": "IMPLEMENTED_ON_CONVERGENCE_BRANCH",
      "authority_effect": "NONE",
      "description": "Implemented only the requested crosswalk, provenance, taxonomy-invariant, schema, checker, test and handoff corrections."
    },
    "owner_approval": {
      "actor": "HUMAN_OWNER",
      "role": "APPROVAL_GATE",
      "status": "PENDING",
      "authority_effect": "NONE",
      "description": "No approval is recorded for canonical promotion, Topics application, merge, release or deployment."
    }
  },
  "historical_source_preservation": {
    "historical_p2_provenance_edited": false,
    "historical_p2_authorship_rewritten": false,
    "original_p2_source_refs_retained": true,
    "historical_source_ref": "research-labs/four-domain-p2-materialization_v0.1.0",
    "current_convergence_provenance_is_distinct": true
  },
  "current_change_surfaces": [
    "docs/research-consolidation/EXTERNAL_LITERATURE_CROSSWALK_V0.1.0.json",
    "docs/research-consolidation/EXTERNAL_LITERATURE_CROSSWALK_V0.1.0.md",
    "docs/research-consolidation/RESEARCH_INDEX_V0.1.0.json",
    "research-workbench/four-domain-materialization/2026-08-14/P2_PACKET_C_EVIDENCE_ADMISSION_RECORD.json",
    "docs/research-consolidation/PUBLIC_DISCOVERABILITY_TAXONOMY_V0.1.0.json",
    "docs/research-consolidation/CROSS_BRANCH_INDEX_V0.1.0.json"
  ],
  "locks": [
    "CANONICAL_EFFECT=NONE",
    "DEPLOYMENT=FALSE",
    "TOPICS_APPLIED=FALSE",
    "MAIN_MERGE=PROHIBITED",
    "OWNER_APPROVAL=PENDING"
  ]
}
